{
  "type": "enforcement",
  "schema_version": "1.1.0",
  "id": "claude-code",
  "harness": "claude-code",
  "version": "1.0.0",
  "invocation_modality": "agent",
  "capabilities": {
    "pre_tool_use": "STRONG",
    "stop": "STRONG",
    "session_start": "STRONG",
    "session_end": "STRONG"
  },
  "classifier": {
    "mode": "default",
    "emits_labels": [
      "read_only",
      "nonsrc_write",
      "shared_write",
      "push_or_pr_create",
      "marker_write",
      "unsafe_complex",
      "unknown"
    ]
  },
  "taxonomy_ref": "patterns/taxonomy.json",
  "taxonomy_version": "sha256:7ea41ed82edef968baee6880f040008080afd962fec9120336ee336796013cc4",
  "events_version": "sha256:13f01e5a599272b349eabd66694b7898e68438e8aad6497e80a9b780bea34ab0",
  "event_translations": {
    "pre_tool_use": {
      "source_format": "claude-code-pre-tool-use-stdin-json",
      "field_bindings": {
        "tool": "$.tool_name",
        "tool_args": "$.tool_input",
        "session_id": "$.session_id",
        "cwd": "$.cwd",
        "turn_index": "$.transcript.length",
        "timestamp_iso8601": "$$now"
      }
    },
    "stop": {
      "source_format": "claude-code-stop-stdin-json",
      "field_bindings": {
        "session_id": "$.session_id",
        "cwd": "$.cwd",
        "turn_index": "$.transcript.length",
        "timestamp_iso8601": "$$now",
        "is_subagent": "$.is_subagent",
        "stop_hook_active": "$.stop_hook_active"
      }
    },
    "session_start": {
      "source_format": "claude-code-session-start-stdin-json",
      "field_bindings": {
        "session_id": "$.session_id",
        "cwd": "$.cwd",
        "timestamp_iso8601": "$$now",
        "harness": "$$const:claude-code",
        "source": "$.source"
      }
    },
    "session_end": {
      "source_format": "claude-code-session-end-stdin-json",
      "field_bindings": {
        "session_id": "$.session_id",
        "cwd": "$.cwd",
        "timestamp_iso8601": "$$now",
        "end_reason": "$.reason"
      }
    }
  },
  "runbook": {
    "full": "plugins/claude-code/runbooks/enforcement.md",
    "quickref": "plugins/claude-code/runbooks/enforcement.quickref.md"
  }
}
