{
  "type": "enforcement",
  "schema_version": "1.0.0",
  "id": "claude-code",
  "harness": "claude-code",
  "version": "1.0.0",
  "invocation_modality": "agent",
  "capabilities": { "pre_tool_use": "STRONG" },
  "classifier": {
    "mode": "override",
    "override_path": "plugins/claude-code/classifier/override.mjs",
    "emits_labels": ["read_only", "shared_write", "marker_write", "unsafe_complex"]
  },
  "taxonomy_ref": "patterns/taxonomy.json",
  "taxonomy_version": "sha256:7ea41ed82edef968baee6880f040008080afd962fec9120336ee336796013cc4",
  "events_version": "sha256:13f01e5a599272b349eabd66694b7898e68438e8aad6497e80a9b780bea34ab0",
  "event_translations": { "pre_tool_use": { "source_format": "x", "field_bindings": { "tool": "$.tool_name" } } },
  "runbook": { "full": "plugins/claude-code/runbooks/enforcement.md", "quickref": "plugins/claude-code/runbooks/enforcement.quickref.md" }
}
